{
  "schemaVersion": "wsgs-gdps-binding-catalog/1.0",
  "authority": "WSGS",
  "policy": {
    "defaultProductIdBinding": "FORBIDDEN",
    "explicitUserProductSelection": "ALLOWED",
    "requiresExactSchemaHashes": true,
    "requiresExactSemanticHash": true,
    "requiresExactDescriptorHash": true,
    "historicalFallback": "FORBIDDEN"
  },
  "operationFamilies": [
    {
      "familyId": "CURRENT_PRODUCT_GET",
      "operationId": "geo-product.get",
      "operationVersion": "1.0",
      "inputSchemaHash": "sha256:f0b37c6d8bb07a27c2223eb81b735255da22d421a26faae5a7e8d948e78a0645",
      "outputSchemaHash": "sha256:8c20cfba8a4f7d54ad043e2a8e949441b92b34771cffced562c5c090df2f93a3",
      "semanticProfileHash": "sha256:8ec1455b0ecd48325fbc30e37ddc445f2f9fcf26d0b7fc1472b2a33b2f839ce8",
      "allowedMaturity": [
        "PREVIEW"
      ],
      "queryProfile": "GET",
      "timeSemantics": "CURRENT"
    },
    {
      "familyId": "CURRENT_PRODUCT_SEARCH",
      "operationId": "geo-product.search",
      "operationVersion": "1.0",
      "inputSchemaHash": "sha256:b951f1d5b3eadbe3fda99131d8dd9cfab851ab34f0ebe033e2b9550b97efa4b7",
      "outputSchemaHash": "sha256:bac750f1d3772e12cab7894794f61bd75a70e6de0d8aeadcfe2c0efd864d6d86",
      "semanticProfileHash": "sha256:a2a5a88a5028adddebc3e13f897b6306db1b96e47bbc367e66e057b7f09d8651",
      "allowedMaturity": [
        "PREVIEW"
      ],
      "queryProfile": "SEARCH",
      "timeSemantics": "CURRENT"
    },
    {
      "familyId": "CURRENT_PRODUCT_CHECK",
      "operationId": "geo-product.check-current",
      "operationVersion": "1.0",
      "inputSchemaHash": "sha256:284dd239dba4acd2fbc0a3a8d31a7bc7fa1783218b85ee5c9dce4ed19ac27ed9",
      "outputSchemaHash": "sha256:67ef7be1d9057705654ce3a17f91c6c76b96dd176384b86e2a2eb269cdf0c475",
      "semanticProfileHash": "sha256:69f1a115e6dcb55d6c5dbe589c9b486fb5ac708aeeec03282c6b665905182034",
      "allowedMaturity": [
        "PREVIEW"
      ],
      "queryProfile": "CHECK_CURRENT",
      "timeSemantics": "CURRENT"
    },
    {
      "familyId": "CURRENT_RASTER_SAMPLE",
      "operationId": "geo-raster.sample",
      "operationVersion": "1.0",
      "inputSchemaHash": "sha256:57983c08d1fafefac136dc44effa137500bca5580056bd68ec01b677747308d4",
      "outputSchemaHash": "sha256:da086a0ab6c1a48ffeac7633acef50b0385851dbf4e9191c24a21f5cd414ecf0",
      "semanticProfileHash": "sha256:c591c93b448564f1508387ee7609efc6c474fd57fde7c6a2394057cf4fdda4cd",
      "allowedMaturity": [
        "PREVIEW"
      ],
      "queryProfile": "SAMPLE",
      "timeSemantics": "CURRENT"
    },
    {
      "familyId": "CURRENT_RASTER_PROFILE",
      "operationId": "geo-raster.profile",
      "operationVersion": "1.0",
      "inputSchemaHash": "sha256:cc68b1d5c0c4ba2d787dcb5cb9d1338d23e99793672bb4740629868696e9dc0a",
      "outputSchemaHash": "sha256:2245c2b4c7675cd8e5677e55486565faf65900a6a4343e562b7cc62df6dd97ed",
      "semanticProfileHash": "sha256:57f429907a34fbf2fcccfabc1b691c50f45d506b1a84aa110bd650045b3b4f50",
      "allowedMaturity": [
        "PREVIEW"
      ],
      "queryProfile": "PROFILE",
      "timeSemantics": "CURRENT"
    },
    {
      "familyId": "CURRENT_RASTER_FIND_CLASS",
      "operationId": "geo-raster.find-by-class",
      "operationVersion": "1.0",
      "inputSchemaHash": "sha256:14420aab786d8ec86249f284c6f65830f8ab4ffec0e2f4e231bc8c6be544581a",
      "outputSchemaHash": "sha256:1dedcf579484d528a24f692310e4ee43a255e9d465ed2fcb0c7d1a2c4d9b43b3",
      "semanticProfileHash": "sha256:cd43bc2e592a272771a323b34c8e6ee19eb630d51ab6f69460b9cb1444cb3d80",
      "allowedMaturity": [
        "PREVIEW"
      ],
      "queryProfile": "FIND_CLASS",
      "timeSemantics": "CURRENT"
    },
    {
      "familyId": "CURRENT_RASTER_FIND_RANGE",
      "operationId": "geo-raster.find-by-range",
      "operationVersion": "1.0",
      "inputSchemaHash": "sha256:59c10af2dc94a8c6fced44dd8efd5e1b3c42a35b2bbc9b6f152e2ba6f867f3ae",
      "outputSchemaHash": "sha256:e9af4d388195493a247cf3691c2a15d984fd555178c79a84fa4f23261ee9546c",
      "semanticProfileHash": "sha256:219a46103e618fe0ebd68e69ced83dc1660310041eca24f6c4cf04300ca3cf8c",
      "allowedMaturity": [
        "PREVIEW"
      ],
      "queryProfile": "FIND_RANGE",
      "timeSemantics": "CURRENT"
    },
    {
      "familyId": "CURRENT_VECTOR_IN_AREA",
      "operationId": "geo-vector.find-in-area",
      "operationVersion": "1.0",
      "inputSchemaHash": "sha256:50cc257202bc08ed59edd875c6d10fedd981b5433019890e3fbe26b0dfb5628d",
      "outputSchemaHash": "sha256:6f5bf35c10ddc6abad03063ed907a2852708daf2405c5e7956ca6f33e6bb1651",
      "semanticProfileHash": "sha256:9ce0aba49412495d420c5e3a069a83f3748d883124aa65f34aed800126e40919",
      "allowedMaturity": [
        "PREVIEW"
      ],
      "queryProfile": "IN_AREA",
      "timeSemantics": "CURRENT"
    },
    {
      "familyId": "CURRENT_VECTOR_NEARBY",
      "operationId": "geo-vector.find-nearby",
      "operationVersion": "1.0",
      "inputSchemaHash": "sha256:a9d1b2603e28391edcdbe719b7a5ba50eb219e98a15108918ae9dff6a434e391",
      "outputSchemaHash": "sha256:a1df3608bf76e11b79b291db197be30638896a5f56a1395c555a4250233a6d7d",
      "semanticProfileHash": "sha256:5cb080097fe97c67b8bfcdf666be00c8218aa3d35a7dd80604fc707cc0ddde4a",
      "allowedMaturity": [
        "PREVIEW"
      ],
      "queryProfile": "NEARBY",
      "timeSemantics": "CURRENT"
    },
    {
      "familyId": "CURRENT_VECTOR_INTERSECTS",
      "operationId": "geo-vector.find-intersections",
      "operationVersion": "1.0",
      "inputSchemaHash": "sha256:86d32f555d2af75d5c017ce3cb6494c800648e8fdebedabeb60c9f19cf9e0b16",
      "outputSchemaHash": "sha256:b9955d7e09a5dc5a007c87bdc2f6cd2dabf3a1ffd6df7d37d2df75b20b00dff9",
      "semanticProfileHash": "sha256:5b7a9eb4862d0b459410c2c440a520e8aded8d731fca996d07274bd2a8a89c17",
      "allowedMaturity": [
        "PREVIEW"
      ],
      "queryProfile": "INTERSECTS",
      "timeSemantics": "CURRENT"
    }
  ],
  "bindings": [
    {
      "bindingId": "ELEVATION_DTM/DEFAULT::SAMPLE_VALUE",
      "requirementKind": "POINT_VALUE",
      "requirementVersion": "1.0",
      "operationId": "geo-raster.sample",
      "operationVersion": "1.0",
      "familyId": "CURRENT_RASTER_SAMPLE",
      "productType": "ELEVATION_DTM",
      "productProfile": "DEFAULT",
      "descriptorId": "ELEVATION_DTM/DEFAULT",
      "descriptorHash": "sha256:7e033d18b36916c2e9db8951b3211769dda96244bbfc4d43fc05854f771b93db",
      "queryProfile": "SAMPLE_VALUE",
      "platformProfilePolicy": "OPTIONAL",
      "inputSchemaHash": "sha256:57983c08d1fafefac136dc44effa137500bca5580056bd68ec01b677747308d4",
      "outputSchemaHash": "sha256:da086a0ab6c1a48ffeac7633acef50b0385851dbf4e9191c24a21f5cd414ecf0",
      "semanticProfileHash": "sha256:c591c93b448564f1508387ee7609efc6c474fd57fde7c6a2394057cf4fdda4cd",
      "allowedMaturity": [
        "PREVIEW"
      ],
      "selectionPolicy": {
        "defaultProductId": null,
        "explicitProductId": "TRUSTED_EXPLICIT_SELECTION_ONLY",
        "requiresFullCoverage": true,
        "scopePolicy": "CURRENT_SCOPE_AUTHORIZED_DESCRIPTOR_MATCH"
      },
      "timeSemantics": "CURRENT",
      "noDataSemantics": "EXPLICIT_GAP",
      "evidenceMapping": {
        "dataSnapshot": "REQUIRED",
        "executionReceipt": "REQUIRED",
        "contentHash": "REQUIRED",
        "descriptorHash": "REQUIRED",
        "temporalApplicability": "CURRENT_AT_QUERY_START"
      }
    },
    {
      "bindingId": "ELEVATION_DTM/DEFAULT::PROFILE_VALUE",
      "requirementKind": "PROFILE",
      "requirementVersion": "1.0",
      "operationId": "geo-raster.profile",
      "operationVersion": "1.0",
      "familyId": "CURRENT_RASTER_PROFILE",
      "productType": "ELEVATION_DTM",
      "productProfile": "DEFAULT",
      "descriptorId": "ELEVATION_DTM/DEFAULT",
      "descriptorHash": "sha256:7e033d18b36916c2e9db8951b3211769dda96244bbfc4d43fc05854f771b93db",
      "queryProfile": "PROFILE_VALUE",
      "platformProfilePolicy": "OPTIONAL",
      "inputSchemaHash": "sha256:cc68b1d5c0c4ba2d787dcb5cb9d1338d23e99793672bb4740629868696e9dc0a",
      "outputSchemaHash": "sha256:2245c2b4c7675cd8e5677e55486565faf65900a6a4343e562b7cc62df6dd97ed",
      "semanticProfileHash": "sha256:57f429907a34fbf2fcccfabc1b691c50f45d506b1a84aa110bd650045b3b4f50",
      "allowedMaturity": [
        "PREVIEW"
      ],
      "selectionPolicy": {
        "defaultProductId": null,
        "explicitProductId": "TRUSTED_EXPLICIT_SELECTION_ONLY",
        "requiresFullCoverage": true,
        "scopePolicy": "CURRENT_SCOPE_AUTHORIZED_DESCRIPTOR_MATCH"
      },
      "timeSemantics": "CURRENT",
      "noDataSemantics": "EXPLICIT_GAP",
      "evidenceMapping": {
        "dataSnapshot": "REQUIRED",
        "executionReceipt": "REQUIRED",
        "contentHash": "REQUIRED",
        "descriptorHash": "REQUIRED",
        "temporalApplicability": "CURRENT_AT_QUERY_START"
      }
    },
    {
      "bindingId": "ELEVATION_DSM/DEFAULT::SAMPLE_VALUE",
      "requirementKind": "POINT_VALUE",
      "requirementVersion": "1.0",
      "operationId": "geo-raster.sample",
      "operationVersion": "1.0",
      "familyId": "CURRENT_RASTER_SAMPLE",
      "productType": "ELEVATION_DSM",
      "productProfile": "DEFAULT",
      "descriptorId": "ELEVATION_DSM/DEFAULT",
      "descriptorHash": "sha256:0cb51b27447449e8ce3337002d88f20eb8700b163a43243414ace14abbab08db",
      "queryProfile": "SAMPLE_VALUE",
      "platformProfilePolicy": "OPTIONAL",
      "inputSchemaHash": "sha256:57983c08d1fafefac136dc44effa137500bca5580056bd68ec01b677747308d4",
      "outputSchemaHash": "sha256:da086a0ab6c1a48ffeac7633acef50b0385851dbf4e9191c24a21f5cd414ecf0",
      "semanticProfileHash": "sha256:c591c93b448564f1508387ee7609efc6c474fd57fde7c6a2394057cf4fdda4cd",
      "allowedMaturity": [
        "PREVIEW"
      ],
      "selectionPolicy": {
        "defaultProductId": null,